"abbreviation","description","contexts"
"ХМЛ","Хронический миелолейкоз","... лет [34]. Еще более редкие случаи заболеваемости ХМЛ у детей. Заболеваемость увеличивается с возрастом... ...4]. В 2012 году во Всероссийском Регистре больных ХМЛ насчитывалось 5655 пациентов, из них 93,1 % — в х... ...ение Ph-положительного хронического миелолейкоза (ХМЛ) включало применение гидроксимочевины, интерферон... ...l является обязательным для установления диагноза ХМЛ. Приблизительно 95% пациентов с хроническим миело... ...или его непереносимости. Хронический миелолейкоз (ХМЛ) — редкое заболевание. Число первичных больных в ... ...ических стволовых клетках. Уникальная особенность ХМЛ — наличие специфического маркера в опухолевых кле... ...иагностикой и лечением хронического миелолейкоза (ХМЛ) кардинально изменилась. Появление препаратов, ун... ... шести с половиной тысяч и более. Патогенетически ХМЛ представляет собой клональный миелопролиферативны... ...ло к быстрому и значительному прогрессу в лечении ХМЛ, а также к важным изменениям в тактике ведения бо... ...(1,2:1). Медиана возраста составляет 11 лет [31]. ХМЛ – двух- или трехфазная болезнь. Начальный, или хр..."
"ХМЛ","Хронический миелоидный лейкоз","... лет [34]. Еще более редкие случаи заболеваемости ХМЛ у детей. Заболеваемость увеличивается с возрастом... ...4]. В 2012 году во Всероссийском Регистре больных ХМЛ насчитывалось 5655 пациентов, из них 93,1 % — в х... ...ение Ph-положительного хронического миелолейкоза (ХМЛ) включало применение гидроксимочевины, интерферон... ...l является обязательным для установления диагноза ХМЛ. Приблизительно 95% пациентов с хроническим миело... ...или его непереносимости. Хронический миелолейкоз (ХМЛ) — редкое заболевание. Число первичных больных в ... ...ических стволовых клетках. Уникальная особенность ХМЛ — наличие специфического маркера в опухолевых кле... ...иагностикой и лечением хронического миелолейкоза (ХМЛ) кардинально изменилась. Появление препаратов, ун... ... шести с половиной тысяч и более. Патогенетически ХМЛ представляет собой клональный миелопролиферативны... ...ло к быстрому и значительному прогрессу в лечении ХМЛ, а также к важным изменениям в тактике ведения бо... ...(1,2:1). Медиана возраста составляет 11 лет [31]. ХМЛ – двух- или трехфазная болезнь. Начальный, или хр..."
"ХФ","Хроническая фаза","...льшого цитогенетического ответа (БЦО) у больных в ХФ, ФА и БК составила 92 и 35%, 74 и 27%, 39 и 18% с... ...ляет примерно 85%. У больных с хронической фазой (ХФ) ХМЛ выживаемость без прогрессирования до фазы ак... ...ки доброкачественно протекающей хронической фазы (ХФ) ХМЛ накапливается большая масса лейкозных клеток... ...осимость. Первичной конечной точкой у пациентов в ХФ был БЦО, определяемый как элиминация (ПЦО, полный... ...полнительных онкогенных путей и прогрессии ХМЛ из ХФ в фазу акселерации (ФА) и бластного криза (БК) [2... ...Полный гематологический ответ (ПГО) у пациентов с ХФ был оценен как вторичная конечная точка. Первично... ...4.2. 	Частота ответа на терапию. 1114 пациентов в ХФ не были включены в оценку, т.к. исходно имели ПГО... ...анее проводимой терапии иматинибом, из них 17 – в ХФ ХМЛ, 56 – в ФА ХМЛ, 24 – с миелоидным БК ХМЛ и 22... ...была проведена у 321 пациента в хронической фазе (ХФ) и 137 пациентов в фазе акселерации (ФА). Доза ни... ...ыделяют три стадии заболевания: хроническая фаза (ХФ), фаза акселерации (ФА) (прогрессирование), бласт..."
"ч","Час","...т принимать 2 раза в сутки (каждые 12 ч), через 2 ч после еды. После применения нилотиниба принимать ... ... натощак. Применение препарата через 30 мин или 2 ч после приема пищи повышало биодоступность нилотин... ...ниба принимать пищу следует не ранее, чем через 1 ч. Капсулы необходимо проглатывать целиком, запивая... ... у пациентов с тяжелыми заболеваниями сердца (в т.ч. нестабильной стенокардией, неконтролируемой хрон... ..., являющимися индукторами изофермента CYP3A4 (в т.ч. фенитоин, рифампицин, карбамазепин, фенобарбитал... ...менении суточной дозы составлял приблизительно 17 ч. При применении нилотиниба у пациентов с нарушени... ...тиниб следует принимать 2 раза в сутки (каждые 12 ч), через 2 ч после еды. После применения нилотиниб... ...лотиниба в плазме крови (Tmax) составляет около 3 ч. Абсорбция нилотиниба после перорального применен... ...ного результата серологического тестирования (в т.ч. при активном инфекционном процессе) следует пров... ...с нарушениями функции печени, с панкреатитом (в т.ч. в анамнезе). Нилотиниб не следует применять одно..."
"ЭКГ","Электрокардиограмма, электрокардиографическое исследование","...ка удлинения интервала QT на электрокардиограмме (ЭКГ): с врожденным удлинением интервала QT, с медикам... ...звитие нейтропении, рвоты и сонливости. Изменений ЭКГ и признаков токсического поражения печени отменен... ...оцессе лечения препаратом рекомендуется проводить ЭКГ-исследование. Перед применением препарата при нео... ... ощущение сердцебиения, удлинение интервала QT на ЭКГ; нечасто - сердечная недостаточность, инфаркт мио..."
