"abbreviation","description","contexts"
"ФК","Фармакокинетика","...ервала PR. Был проведен один анализ эффективности ФК ФД, который показал, что плато в ответе будет дос... ...динамика и механизм действия	53 4.2.2.Взаимосвязь ФК/ФД	54 4.3.Безопасность и эффективность	54 4.3.1.К... ...ки.  Внутри - и межиндивидуальная вариабельность  ФК лакосамида характеризуется низкой внутрииндивидуа... ...д в дозе 800 мг/сут, соответственно.  Взаимосвязь ФК/ФД  Лакосамид увеличивает интервал PR. Эффект зав... ...приведены в таблице ниже.  Таблица 4.1. Параметры ФК в объединенной популяции (общая популяция и попул... ...ирования. Кроме того, было проведено исследование ФК у всех пролеченных в исследовании пациентов метод... ...я CAMN107A2303, в котором оценка фармакокинетики (ФК) нилотиниба в дозах 300 мг 2 раза в день и 400 мг... ... в разрешенной дозе. Были получены полные профили ФК для общей популяции пациентов и подгруппы японски... ...еления не менее 2,50 нг/мл. Результаты параметров ФК приведены в таблице ниже.  Таблица 4.1. Параметры..."
"ЦНС","Центральная нервная система","...аркозом.  Влияние на центральную нервную систему (ЦНС)  Ранний нейрофармакологический скрининг-тест на ... ...и эту дозу из-за нежелательных реакций со стороны ЦНС и желудочно-кишечного тракта. Таким образом, доза... ...была хуже по причине побочных эффектов со стороны ЦНС и ЖКТ. Поэтому использование дозы 600 мг/сут не р... ...жного воздействия на центральную нервную систему (ЦНС) получены не были. Исследования I фазы с исследов... ...ом экспрессируется в центральной нервной системе (ЦНС) и участвует в дифференцировке нейронов и росте а... ...та встречаемости нежелательных реакций со стороны ЦНС, таких как головокружение, может быть выше после ... ...х реакций со стороны центральной нервной системы (ЦНС) и желудочно-кишечного тракта (ЖКТ), в динамике, ... ...т наблюдалась клиническая симптоматика со стороны ЦНС и ЖКТ (головокружение и тошнота), которая исчезал..."
"3Т3 NRU","3Т3 Neutral Red Ultraviolet, клеточная линия фибробластов мышей-альбиносов (3Т3), подвергаемая витальному воздействию красителя нейтрального красного и регистрации ультрафиолетового излучения от клеток","...ичие фототоксического потенциала в тесте in vitro 3Т3 NRU, однако проведенный тест in vivo UV-LLNA на мышах..."
"Abl","Abelson murine leukemia viral oncogene homolog, протонкоген Абельсона","... ген Bcr-Abl, кодирующий синтез онкопротеина (Bcr-Abl-тирозинкиназа, или белок р210); его продукция при... ... и апоптоз. Выявление Ph-хромосомы, либо гена BCR-Abl является обязательным для установления диагноза Х... ...таргетного (целенаправленного) воздействия на BCR-Abl-положительные опухолевые клетки. При этом снижает... ...пии ХМЛ препаратов, ингибирующих зависимую от Bcr-Abl тирозинкиназу (ИТК), и высокой эффективностью это... ...тками между хромосомами) протонокогена Абельсона (Abl), кодирующего нерецепторную тирозинкиназу, находя... ...ьфийской хромосомы и образование онкопротеина BCR-Abl.  По мере развития ХМЛ становится всё более агрес... ...фобластным лейкозом экспрессируют онкопротеин BCR-Abl и положительны по наличию филадельфийской хромосо... ...(Ph-хромосома), и формирование химерного гена BCR-Abl (рисунок 1). В последующем химерный ген начинает ... ...настоящее время является терапия ингибиторами BCR-Abl тирозинкиназы. Данные препараты имеют механизм та... ...тате на 22-й хромосоме образуется слитный ген Bcr-Abl, кодирующий синтез онкопротеина (Bcr-Abl-тирозинк..."
"AUC","Area Under the Curve, площадь под кривой – фармакокинетический параметр, характеризующий суммарную концентрацию лекарственного препарата в плазме крови в течение определенного времени наблюдения","...ом, данные способы применения эквивалентны как по AUC, так и по Cmax. 4.1.1.3. Исследование фармакокине... ...о ингибировали изофермент CYP3A4 и Р-ГП, при этом AUC иматиниба повышалась на 18-39%, a AUC нилотиниба ... ...го уровня нилотиниба в плазме человека (по данным AUC). Следовательно, для данного вида токсичности коэ... ..., чем при применении в дозе 800 мг 1 раз в сутки. AUC нилотиниба при приеме в дозе 400 мг 2 раза в сутк... ...ении фармакокинетических исследованиях (по данным AUC) на крысах после введения повторных доз, по сравн... ...способы введения демонстрируют эквивалентность по AUC, но не по Cmax. При однократном приеме нилотиниба... ... концентраций препарата в плазме крови (по данным AUC) после введения повторных доз, по сравнению с одн... ...однократном приеме препарата наблюдалось снижение AUC нилотиниба на 35%, 35% и 19% у пациентов с наруше... ...(Сmах) и площадь под кривой «концентрация-время» (AUC) нилотиниба повышались на 112% и 82%, соответстве... ... доз Для препарата нилотиниб, на основании данных AUC в плазме крови животных, в пересчёте на значения ..."
"BCR","Breakpoint cluster region gene, ген точечного разрыва кластерного региона","...тирозинкиназную активность онкобелков, кодируемых BCR/ABL1, привело к быстрому и значительному прогресс... ...адельфийской хромосомы и образование онкопротеина BCR-Abl.  По мере развития ХМЛ становится всё более а... ...ома (Ph-хромосома), и формирование химерного гена BCR-Abl (рисунок 1). В последующем химерный ген начин... ...лка в культурах клеток, экспрессирующих дикий тип BCR-Abl, составила 15 и 280 нмоль у нилотиниба и имат... ...я в настоящее время является терапия ингибиторами BCR-Abl тирозинкиназы. Данные препараты имеют механиз... ...езию и апоптоз. Выявление Ph-хромосомы, либо гена BCR-Abl является обязательным для установления диагно... ... лимфобластным лейкозом экспрессируют онкопротеин BCR-Abl и положительны по наличию филадельфийской хро... ...к, экспрессирующих как дикий, так и мутантный ген BCR-Abl, к нилотинибу по сравнению с иматинибом. Инги... ...изм таргетного (целенаправленного) воздействия на BCR-Abl-положительные опухолевые клетки. При этом сни... ...мы, и гена точечного разрыва кластерного региона (BCR), кодирующего фосфопротеин в сегменте q11 22 хром..."
"BCR-Abl","BCR-Abl-тирозинкиназа","...изм таргетного (целенаправленного) воздействия на BCR-Abl-положительные опухолевые клетки. При этом снижает... ... лимфобластным лейкозом экспрессируют онкопротеин BCR-Abl и положительны по наличию филадельфийской хромосо... ...адельфийской хромосомы и образование онкопротеина BCR-Abl.  По мере развития ХМЛ становится всё более агрес... ...ибитор активности тирозинкиназы Abl онкопротеинов BCR-Abl, что действует в клеточных линиях и в первичных п... ...к, экспрессирующих как дикий, так и мутантный ген BCR-Abl, к нилотинибу по сравнению с иматинибом. Ингибиру... ...я в настоящее время является терапия ингибиторами BCR-Abl тирозинкиназы. Данные препараты имеют механизм та... ...еток, экспрессирующих разные виды мутантных генов BCR-Abl. Кроме того, ввиду высокой стоимости ИТК ежегодно... ...ома (Ph-хромосома), и формирование химерного гена BCR-Abl (рисунок 1). В последующем химерный ген начинает ... ...лка в культурах клеток, экспрессирующих дикий тип BCR-Abl, составила 15 и 280 нмоль у нилотиниба и иматиниб... ...езию и апоптоз. Выявление Ph-хромосомы, либо гена BCR-Abl является обязательным для установления диагноза Х..."
"Cmax","Максимальная концентрация лекарственного вещества в крови","...м при приеме целых капсул, наблюдалось увеличение Cmax, AUC0-tlast и AUC0-∞ на   31%, 11% и 8% соответст... ...ия демонстрируют эквивалентность по AUC, но не по Cmax. При однократном приеме нилотиниба, перемешанного... ...собы применения эквивалентны как по AUC, так и по Cmax. 4.1.1.3. Исследование фармакокинетики у пациенто..."
"EGFR","Epidermal growth factor receptor, Рецептор эпидермального фактора роста","...спрессирующих другие тирозинкиназы (VEGFR, Jak-2, EGFR, Ras, PKB и др.) [8, 10]. Нилотиниб подавлял прол..."
"FIP1L1","Factor interacting with poly(A) polymerase L1; фактор, взаимодействующий с поли(А)-полимеразой","...or receptor β), так и клеток, экспрессирующих ген FIP1L1-PDGFRα (FIP1-Like1-platelet derived growth factor... ...22,2 нмоль), то клетки, экспрессирующие мутантный FIP1L1-PDGFRα—T674I, оставались к нему резистентными (IC... ... в разных фазах, Ph+ острый лимфобластный лейкоз, FIP1L1-PDGFRα+ гиперэозинофильный синдром, TEL-PDGFRβ+ х... ...летками, экспрессирующими дикие гены TEL-PDGFRβ и FIP1L1-PDGFRα при однократном пероральном введении в доз..."
"IC50","Inhibition concentration, ингибирующая концентрация","... в 10 и 30 раз соответственно ниже по сравнению с IC50 иматиниба. При этом для нилотиниба этот показател... ...клеток, мутантных по BCR-Abl (кроме BCR-AblT315I; IC50>10000 нмоль) — это ниже концентрации препарата, с... ... Эти концентрации препарата были существенно выше IC50 нилотиниба, необходимой для подавления пролиферат... ...ьтурах клеток, экспрессирующих дикий тип BCR-Abl, IC50 нилотиниба для подавления пролиферации и аутофосф... ...— T681I, сохраняли чувствительность к нилотинибу (IC50 22,2 нмоль), то клетки, экспрессирующие мутантный... ...очные линии, экспрессирующие мутантный ген T315I. IC50 для подавления фосфорилирования субстратов BCR-Ab... ...МЛ и гиперэозинофильного синдрома соответственно. IC50 нилотиниба и иматиниба для подавления пролифераци... ...0), была значительно ниже таковой иматиниба. Так, IC50, необходимая для подавления фосфорилирования субс... ...бходимая для подавления 50% лейкемических клеток (IC50), была значительно ниже таковой иматиниба. Так, I... ...L1-PDGFRα—T674I, оставались к нему резистентными (IC50 не была достигнута). Эффективность препарата была..."
"ICH","Международная конференция по гармонизации (International Conference for Harmonization)","...дуктов, предназначенных для применения человеком (ICH), проведения оценки канцерогенного потенциала для..."
"Jak-2","Janus kinase 2, Янус-киназа 2 типа","...ток, экспрессирующих другие тирозинкиназы (VEGFR, Jak-2, EGFR, Ras, PKB и др.) [8, 10]. Нилотиниб подавля..."
"PDGFR","Platelet derived growth factor receptor, рецептор тромбоцитарного фактора роста","... и некоторых мутантных видов тирозинкиназ c-kit и PDGFR. При этом активность препарата в клеточных линиях..."
"Ph","Philadelphia chromosome, «Филадельфийская» хромосома","...етических дефектов [6, 14]. Чем дольше существует Ph-позитивный клон, тем выше вероятность возникновен... ...современной терапии ХМЛ — максимальное подавление Ph-положительного опухолевого клона. Стандартом лече... ...ovartis, Базель, Швейцария). До иматиниба лечение Ph-положительного хронического миелолейкоза (ХМЛ) вк... ...и образование так называемой филадельфийской, или Ph'- хромосомы [15, 20]. В результате на 22-й хромос... ...ению опухолевой массы и приводит к восстановлению Ph'-негативного кроветворения. Применение ИТК при ХМ... ...ию, дифференцировку, адгезию и апоптоз. Выявление Ph-хромосомы, либо гена BCR-Abl является обязательны... ...оложительны по наличию филадельфийской хромосомы (Ph+) [12]. Эта мутация является одной из самых распр... ...мосомы, так называемая филадельфийская хромосома (Ph-хромосома), и формирование химерного гена BCR-Abl... ...ваний, при которых нилотиниб может быть активен — Ph+/BCRAbl+ ХМЛ в разных фазах, Ph+ острый лимфоблас... ...ет быть активен — Ph+/BCRAbl+ ХМЛ в разных фазах, Ph+ острый лимфобластный лейкоз, FIP1L1-PDGFRα+ гипе..."
"Ph+","Клетки, содержащие филадельфийскую хромосому","...ет быть активен — Ph+/BCRAbl+ ХМЛ в разных фазах, Ph+ острый лимфобластный лейкоз, FIP1L1-PDGFRα+ гипер... ...вично положительных по филадельфийской хромосоме (Ph+) лейкозных клеток. Препарат обладает высоким срод... ...нию оптимальной дозы и безопасности терапии ХМЛ и Ph+ острого лимфолейкоза нилотинибом были включены 11... ...ваний, при которых нилотиниб может быть активен — Ph+/BCRAbl+ ХМЛ в разных фазах, Ph+ острый лимфобласт... ... с миелоидным БК ХМЛ и 22 – с лимфоидным БК ХМЛ и Ph+ острым лимфолейкозом. Доза нилотиниба варьировала... ...вязанные с применением нилотиниба): У пациентов с Ph+ XMЛ в хронической фазе и фазе акселерации, получа... ...жести по СТСАЕ. Прекращение лечения у пациентов с Ph+ ХМЛ в хронической фазе, которые достигли устойчив... ...ьфийской хромосоме хронический миелоидный лейкоз (Ph+ ХМЛ) в хронической фазе и фазе акселерации у взро... ...оложительны по наличию филадельфийской хромосомы (Ph+) [12]. Эта мутация является одной из самых распро... ...зе и 10% пациентов в фазе акселерации. Пациенты с Ph+ XMЛ в хронической фазе, не достигшие МО 4.5 или б..."
"PKB","Protein Kinase B, протеинкиназа тип В","...их другие тирозинкиназы (VEGFR, Jak-2, EGFR, Ras, PKB и др.) [8, 10]. Нилотиниб подавлял пролиферативну..."
"QTcF","QT- интервал, скорректированный по формуле Fredericia","...значений. QTcF> 500 мс не наблюдалось, увеличение QTcF по сравнению с исходным уровнем, превышающим 60 м... ...роль для выявления возможного удлинения интервала QTcF. Следует также избегать одновременного применения... ...я наблюдались у 3% пациентов. Изменение интервала QTcF составляло 6 мсек относительно исходных значений.... ...1% пациентов, соответственно. Удлинение интервала QTcF более 500 мс наблюдалось у <1% пациентов. Эпизоды... ...составляло 6 мсек относительно исходных значений. QTcF> 500 мс не наблюдалось, увеличение QTcF по сравне..."
"Ras","Retrovirus-associated sarcoma gene, ген, связанный с саркомой, вызываемой ретровирусом у крыс","...ирующих другие тирозинкиназы (VEGFR, Jak-2, EGFR, Ras, PKB и др.) [8, 10]. Нилотиниб подавлял пролифера..."
"TEL","Translocated ETS (E26 transformation-specific) leukemia, транскрипционный фактор трансформации E26, связанный с развитием лейкемии","...ейкоз, FIP1L1-PDGFRα+ гиперэозинофильный синдром, TEL-PDGFRβ+ хронический миеломоноцитарный лейкоз, c-k... ...тивную активность как клеток, экспрессирующих ген TEL-PDGFRβ (TEL-platelet derived growth factor recept... ...иб-резистентные клетки, экспрессирующие мутантный TEL-PDGFRβ— T681I, сохраняли чувствительность к нилот... ...нтированных клетками, экспрессирующими дикие гены TEL-PDGFRβ и FIP1L1-PDGFRα при однократном перорально... ...ность как клеток, экспрессирующих ген TEL-PDGFRβ (TEL-platelet derived growth factor receptor β), так и..."
"Tmax","Время достижения максимальной концентрации лекарственного вещества","...симальной концентрации нилотиниба в плазме крови (Tmax) составляет около 3 ч. Абсорбция нилотиниба после... ...абсорбции после перорального введения у животных, Tmax колебался от получаса до 4 часов. Также в исследо..."
"UV-LLNA","Ultra violet local lymph node assay, метод локальных лимфатических узлов при ультрафиолетовом облучении","...in vitro 3Т3 NRU, однако проведенный тест in vivo UV-LLNA на мышах, не выявил наличия фототоксичности препа..."
"VEGFR","Vascular Endothelial Growth Factor Receptor, рецептор фактора роста эндотелия сосудов","...цию клеток, экспрессирующих другие тирозинкиназы (VEGFR, Jak-2, EGFR, Ras, PKB и др.) [8, 10]. Нилотиниб ..."
"АД","артериальное давление","...осудов: часто - повышение артериального давления (АД), «приливы» крови; нечасто - гипертонический криз... ...астота неизвестна - геморрагический шок, снижение АД, тромбоз, стеноз периферических артерий. Нарушени..."
"АЛТ","Аланинаминотрасфераза","...ы биохимических показателей наблюдались повышение АЛТ (24%), гипербилирубинемия (16%), повышение АСТ (1... ...онения, представленные преимущественно повышением АЛТ, АСТ, липазы. Прием лекарственных препаратов, хар..."
"АСТ","Аспартатаминотрансмфераза","...ие АЛТ (24%), гипербилирубинемия (16%), повышение АСТ (12%), липазы (11%), билирубина в крови (10%), ги... ...я, представленные преимущественно повышением АЛТ, АСТ, липазы. Прием лекарственных препаратов, характер..."
